1,1,Spicy Ahi Roll,Sushi,16.5,"ocean wise ahi tuna, mango, avocado, asparagus, cucumber, sesame soy paper, wasabi mayo, cripy yam curls",500,3,placeholder
2,1,Prawn Crunch Roll,Sushi,16,"crispy prawn, mango, avocado, asparagus, cucumber, sesame soy paper, sriracha mayo, soy glaze",500,4,placeholder
3,1,Ceviche,Appetizers,18.5,"ocean wise lois lake steelhead, sustainably harvested prawns, avocado, chili, thai basil, mint, peruvian leche de tigre marinade",750,2,placeholder
4,1,Mini crispy chicken sandwiches,Appetizers,16,"spicy panko-crusted chicken, swiss cheese, sambal mayo, lettuce, tomato, pickle, onion",1100,5,placeholder
5,1,Modern bowl,Bowls,21.5,"tabbouleh, pineapple salsa, broccoli, tomatoes, cucumber, fresh greens, jasmine rice, miso carrot ginger sauce, chicken",450,3,placeholder
6,1,Tuna poke bowl,Bowls,20.5,"sesame ginger ocean wise, ahi, jasmine rice, mango, cucumber, mango, cucumber, avocado, edamane, radish, crispy, tempura",800,4,placeholder

